{"schema_version":"4.0","lineage_id":"aaaaaaaaaaaaaaaaaaaaaaaaaaaaaaaaaaaaaaaaaaaaaaaaaaaaaaaaaaaaaaaa","version":"v1","previous_version":"v0","previous_bundle_ref":{"path":"prompt-development/versions/v0/snapshot.json","sha256":"bbbbbbbbbbbbbbbbbbbbbbbbbbbbbbbbbbbbbbbbbbbbbbbbbbbbbbbbbbbbbbbb"},"new_bundle_ref":{"path":"prompt-development/versions/v1/snapshot.json","sha256":"cccccccccccccccccccccccccccccccccccccccccccccccccccccccccccccccc"},"hypothesis":"Clarify construction and repair together.","evidence_refs":[{"path":"prompt-development/versions/v0/assessment-n003.json","sha256":"dddddddddddddddddddddddddddddddddddddddddddddddddddddddddddddddd"}],"expected_gates":["arch_07"],"expected_metrics":["p2"],"changed_stages":["initial","repair"],"unified_diffs":{"initial":"--- v0/initial\n+++ v1/initial\n","repair":"--- v0/repair\n+++ v1/repair\n"},"stopping_conclusion":"Use the next three samples to decide.","protocol_ref":{"path":"prompt-development/protocol.json","sha256":"eeeeeeeeeeeeeeeeeeeeeeeeeeeeeeeeeeeeeeeeeeeeeeeeeeeeeeeeeeeeeeee"},"status":"admitted"}
